{
  "format": 1,
  "instance_id": "11111111111111111111111111111111",
  "profile": "default",
  "generation": "sha256:aaaaaaaaaaaaaaaaaaaaaaaaaaaaaaaaaaaaaaaaaaaaaaaaaaaaaaaaaaaaaaaa",
  "prepared_head": "sha256:aaaaaaaaaaaaaaaaaaaaaaaaaaaaaaaaaaaaaaaaaaaaaaaaaaaaaaaaaaaaaaaa",
  "defaults": {},
  "entries": [
    {
      "package": "core:example",
      "stream": null,
      "artifact": "sha256:aaaaaaaaaaaaaaaaaaaaaaaaaaaaaaaaaaaaaaaaaaaaaaaaaaaaaaaaaaaaaaaa",
      "package_record": {
        "digest": "sha256:aaaaaaaaaaaaaaaaaaaaaaaaaaaaaaaaaaaaaaaaaaaaaaaaaaaaaaaaaaaaaaaa",
        "size": 1
      },
      "manifest": {
        "digest": "sha256:aaaaaaaaaaaaaaaaaaaaaaaaaaaaaaaaaaaaaaaaaaaaaaaaaaaaaaaaaaaaaaaa",
        "size": 1
      },
      "materialization": {
        "digest": "sha256:aaaaaaaaaaaaaaaaaaaaaaaaaaaaaaaaaaaaaaaaaaaaaaaaaaaaaaaaaaaaaaaa",
        "size": 1
      },
      "dependencies": [],
      "configuration": [],
      "cpu_features": [
        "sse2"
      ],
      "min_os": "10.11",
      "max_os": null
    }
  ]
}
